{"action_config":{"dimension":2,"dtype":"float32","order":["steering","longitudinal"],"version":"action-v1"},"algorithm":"ppo","checkpoint_step":81920,"config_hashes":{"action":"1be1622274d442089fbc329d5bac7012e4e3c8de4c534593581265c90d6eea52","env":"6b3421484f124f9c82529dfa76b08b9b0ced947fa8dcca55d9e3dae6175651f3","observation":"2a0d53ff3a162782f9f0d46dabee1a33c103a59949ea770ea07e01fb4aea4125","physics":"a89ead7c3a030b86f409e7159028074d90a1167f9161472333ddb1793fe807b8","training":"4b738545a743c8a6b8eae56cb48b7b9a08c39d377c81825e0bb62abf542265d8"},"dependencies":{"git_commit":null,"packages":{"PyYAML":"6.0.3","gymnasium":"1.4.0","numpy":"2.4.6","stable_baselines3":"2.9.0","tensorboard":"2.21.0","torch":"2.14.1+cpu"},"platform":"Linux-6.18.48+-x86_64-with-glibc2.39","python":"3.11.16"},"env_config":{"lap_bonus":50.0,"max_steps":1200,"no_progress_steps":120,"off_track_penalty":-10.0,"progress_coefficient":2.0,"progress_threshold_m":0.01,"reward_version":"reward-v1","steering_penalty":0.01,"step_cost":0.002,"target_laps":1},"fixture_only":false,"hyperparameters":{"activation_fn":"torch.nn.Tanh","algo":"ppo","batch_size":64,"clip_range":0.2,"device":"cpu","ent_coef":0.0,"eval_every_steps":10000,"eval_seeds":[9000,9001,9002,9003,9004],"gae_lambda":0.95,"gamma":0.99,"learning_rate":0.0003,"max_grad_norm":0.5,"n_envs":1,"n_epochs":10,"n_steps":2048,"optimizer_class":"torch.optim.Adam","optimizer_defaults":{"amsgrad":false,"betas":[0.9,0.999],"capturable":false,"decoupled_weight_decay":false,"differentiable":false,"eps":1e-05,"foreach":null,"fused":null,"lr":0.0003,"maximize":false,"weight_decay":0},"policy":"MlpPolicy","policy_kwargs":{"net_arch":{"pi":[64,64],"vf":[64,64]}},"seed":42,"target_laps":1,"total_timesteps":1000000,"track_id":"demo","vf_coef":0.5},"model_sha256":"bb9c922620c79595534b990cf9d2e29a2562dc0c9aa120410cd6aa899fd9a612","normalization":"none","observation_config":{"dimension":11,"dtype":"float32","ray_angles_deg":[-90.0,-60.0,-30.0,0.0,30.0,60.0,90.0],"ray_range_m":40.0,"version":"obs-rays7-v1"},"physics_config":{"acceleration_mps2":6.0,"braking_mps2":10.0,"car_radius_m":0.8,"dt_s":0.05,"max_speed_mps":22.0,"max_steer_rad":0.55,"rolling_drag_mps2":0.25,"steering_slew_radps":2.5,"wheelbase_m":2.6},"policy":"MlpPolicy","schema_version":"model-v1","selection_metrics":{"all_success":true,"checkpoint_step":81920,"macro_completion":1.0,"macro_mean_lap_time_s":27.8,"macro_progress":1.0,"update_count":40},"train_track_hashes":["960352b04ce6f6d45661e0e60b7bc68e1fd90133fd9bd52637dec718affb63c4"],"training_seed":42,"update_count":40,"versions":{"action":"action-v1","evaluation":"evaluation-v1","observation":"obs-rays7-v1","physics":"physics-v1","reward":"reward-v1","selection":"selection-v1","track":"track-v1"}}
