{"action_config":{"dimension":2,"dtype":"float32","order":["steering","longitudinal"],"version":"action-v1"},"algorithm":"ppo","checkpoint_step":200704,"config_hashes":{"action":"1be1622274d442089fbc329d5bac7012e4e3c8de4c534593581265c90d6eea52","env":"6b3421484f124f9c82529dfa76b08b9b0ced947fa8dcca55d9e3dae6175651f3","observation":"2a0d53ff3a162782f9f0d46dabee1a33c103a59949ea770ea07e01fb4aea4125","physics":"a89ead7c3a030b86f409e7159028074d90a1167f9161472333ddb1793fe807b8","training":"b8c44d2360cd91be34b2d70f6488fdf86d1f08ae0e64a4016e384f0b63639d92"},"dependencies":{"git_commit":null,"packages":{"PyYAML":"6.0.3","gymnasium":"1.4.0","numpy":"2.4.6","stable_baselines3":"2.9.0","tensorboard":"2.21.0","torch":"2.14.1+cpu"},"platform":"Linux-6.18.48+-x86_64-with-glibc2.39","python":"3.11.16"},"env_config":{"lap_bonus":50.0,"max_steps":1200,"no_progress_steps":120,"off_track_penalty":-10.0,"progress_coefficient":2.0,"progress_threshold_m":0.01,"reward_version":"reward-v1","steering_penalty":0.01,"step_cost":0.002,"target_laps":1},"fixture_only":false,"hyperparameters":{"activation_fn":"torch.nn.Tanh","algo":"ppo","batch_size":64,"clip_range":0.2,"condition":"multi","device":"cpu","ent_coef":0.0,"eval_every_steps":50000,"eval_seeds":[9000,9001,9002],"evaluation_split":"validation","execution_profile_registration":"/kaggle/working/ai-racing/execution-profile.phase04.json","gae_lambda":0.95,"gamma":0.99,"learning_rate":0.0003,"max_grad_norm":0.5,"n_envs":1,"n_epochs":10,"n_steps":2048,"optimizer_class":"torch.optim.Adam","optimizer_defaults":{"amsgrad":false,"betas":[0.9,0.999],"capturable":false,"decoupled_weight_decay":false,"differentiable":false,"eps":1e-05,"foreach":null,"fused":null,"lr":0.0003,"maximize":false,"weight_decay":0},"policy":"MlpPolicy","policy_kwargs":{"net_arch":{"pi":[64,64],"vf":[64,64]}},"seed":42,"split_manifest":"experiments/splits/v1.json","target_laps":1,"total_timesteps":1000000,"track_id":"demo","track_sampling":"uniform_train","vf_coef":0.5},"model_sha256":"be73a04080765783343ddea18834d888ed7c4d45442084c33ce7497afb743d49","normalization":"none","observation_config":{"dimension":11,"dtype":"float32","ray_angles_deg":[-90.0,-60.0,-30.0,0.0,30.0,60.0,90.0],"ray_range_m":40.0,"version":"obs-rays7-v1"},"physics_config":{"acceleration_mps2":6.0,"braking_mps2":10.0,"car_radius_m":0.8,"dt_s":0.05,"max_speed_mps":22.0,"max_steer_rad":0.55,"rolling_drag_mps2":0.25,"steering_slew_radps":2.5,"wheelbase_m":2.6},"policy":"MlpPolicy","schema_version":"model-v1","selection_metrics":{"all_success":true,"checkpoint_step":200704,"macro_completion":1.0,"macro_mean_lap_time_s":27.473333333333336,"macro_progress":1.0,"update_count":98},"train_track_hashes":["fa485fb6aeb1477796821dc7d73a760a9b0b9e934e824afe39878effdc12a1e7","16fffdc6e13a192095b872381df38d35842d55b46a583e4d694c63b781fde7ce","6a74cf682ad0ca758c1d0391ad54166e0e11f8a3ff497d19b49f63b2c90cc0d9","9de21c40d81b5002326ca4f758be53fdafb5630616eb294b035e147e722d5d01","23cc9d9d21d27099a31a485de4936b5d565deccfdee196892701c132a04b2056","c3aa8c8d39c765f3b2b6e98c7acb81b907c4598331675c3045a0070c45c65cfb","49f015537d5363057607d5f377e9d806a1b7ea2b0fcd32e4348d7b5319aff098","9fd2087055a832ef11bbf29d3cb02128675aab7caee7901629d1195390dec771","638eddbc4ef04fc3df9babc7da570e578a4f08221d95e51e2aeb49006c12844d","da9ff1bb2fe843467f9642cb83f2a207eda9a30992755408f5a356a683375f19","713c88957c96559ccaba0adda07baf0b6dcec76bea30342416659e54e7067efa","fdea9965122dcac0252612c92de460360e65473ed69423fbd5bdd335b87b97d0","7d8b995eec1bbeaa919ae26806eec60e7260fa62ee4fe1563be79b605002b4c5","8e137a831d5f2440d247ed351e6bab9a46a255347e1db8d349365db14da07bbb","ef0a3a34d155bee3000aad165a5224075c2ad92cd0d138c1552f1062f8af5c14","32273e00b45db2f15ccb7815cbf7a3a02df2b20cb5a6ad53518c9fff96cdc317","26143a1ba52e21dbb82bf85d5dc163fc09bdbfc9e0f284613ed237fa267a10bb","21c1a4dfaa979ff6ad23934f41210d3ea319cb326edb2f7ea0d42c42e3f2d8a5","704251d561c19146086372fba4b28a45b3e3d226bd915fcea07bc256f4d53c65","97b08aa1acd96a21858e0279216a0393016333131bdb56a4d16f813778052007","07f4ae3f70d44e09a13afe725c77506579017bbf35b8f485219893741013c735","8f0306a70c5ab90372f90c4a425c5b77c32b30517866780a08f296de8881a404","eac9b85166cb598207dedf06a937ca0d3b23b05973456e46e48369d55d5f4758","755fb5df06c9d22125e5128f842e11ba3fdeeb4f14e152f05aee36e072b50efe","7937876cbb4794a845bfc02fe5b863f326dd6175a9a7d33585cb30670f17f32f","05a8063248971de995dd9656f6f6938721194955cd9ab5aaca342bfcf6381af8","0adf7c08d85f77516610ac9f9664407cd21f01a7f634a50143d76dfe4717a650","2cdcdd73683506f5fae665fdafb02e91e07c156fc7a315e7b8505009abd0fb06","eb5a8444c6274e94e4a377adc09388120d7b8167f0286f498f6128bbb7b28c36","a28f3c98bffe265388d8779c142cf4a4c7443f12c4aad29dd80cf5c228c64a0d","be0c4e287f5bd14976eafa6cfdbc878276685d77ea061893225cf52df7c48227","e00b8c579ceb03078819262845e298f6546a7f5d497ebc66509b6a7d855b1676","32cfd8a16bcad08541fde8560a02f728b0f1eb8b2e283a30407b44a1782b5bbc","5e0f955dc07ae7b95ec90ca174070cbf82863d0c4157830e58e29227e114dda6","0edfe36c34f222bf2af7aac204a3d85d6d4eefb927d01831f34a72be6ef2a5b7","ecd7dde1420933cc47b0f647a9a0e092f8546bb804599977081e593072433f53","0027f9c5741b67f4e19107b8071c1deda066b42a2d2e87f9c1f9ce3875378d7c","a9921661de2c9cb3261e4f31587abec1ae5224288f004f2a2fb4d371e0973eee","d38ce53dbde2574939a1d1c132fc6d0e37d098823e26774686180818725effe3","05415ac300901744266c2fdbcacd04fc166880337be0d84f79762246516bdfe2","f9f6f3bba6ec92aff16e27d31eb94727a3f59d7e1f1807c3124e673494469312","ddf7134887aa033db15c054bdda25a48de872eca5d614bd60b45c3c8bedbf98c","762effa3e2a98db9de8afdf4eea35814e1bc989513995a4e0cf0e65c89ccda8a","ea188081dea53edbc39d1093817a151a9f5570fdf4fe58f0db3894bf9db4c010","736402eea53d4b4bd810237e6bf122f857da6c7db1e4c2ef47f2ce980811e086","14cbc20ef45bae7522e95589d6ae6ddd6691baa65ef76a332c9763435e5f1b05","ef51d6578f1b52fa2cebc5614429645fa5092bd01ceeba508c765e9f1726334c","ed01b2bbfe2a3ff02f6b9e5e21839c0a71366fcfe79b74bf776e536ea60c6617","07b37ed8fabfb4359b3d90d16970d45108b41108aec959c93c756fd42815dcb2","64b7c0ae54c70779347f65c915fb1cfa1befce914cd41e30f46fb67d059add2a","c2837b1149f6ccdc2cbdc64fb77be5e3f2d235964baa3e6b835762ad5d9f5369","ddf6ae8134ec46eaa6dfc5e9a3fe61774dca10cb02398b2f9ba481e281fd9073","65fe621896a5f7f166bf60be69954c47c74ee2043153d035edcdbe35e35ecf6e","34f3ed5356f30fe45ecfe9595917472a89e27f096a4ea83fcb6361b08954301f","2e60efe17ca17f2849336315f7c2d7d23facc2353151cb6d285e2643693da28a","cd7743f27d8d58122dbf9aed15798308bdb49744fa2f9276a7a72f84b54ed245","48572415515d16556ad37466f562ad6a0fd0713c4d5782c63a03279d7eab7ec7","7d204e44054251a1b6e2729fc2dea44169735833facab68e683811f4fe0e8c91","fb8390af38abbedadbe64323e07d2565295374e3e17545de32582f9188ae75e2","5701ca0aeb84358d01b1a559da5f0172c2faf8622c6aa67c78d37949545bbe4f"],"training_seed":42,"update_count":98,"versions":{"action":"action-v1","evaluation":"evaluation-v1","observation":"obs-rays7-v1","physics":"physics-v1","reward":"reward-v1","selection":"selection-v1","track":"track-v1"}}
